{
  "schema": "sns.governance-authorization.v1",
  "authorization_id": "AUTH-20260831T163436000000Z-sim3-role-mix-63dfa448abd5cc06acbd",
  "issued_by_loop": "daily-governance-triage",
  "action_type": "refine_existing",
  "quest_id": "QST-SIM-0003",
  "recorded_at": "2026-08-31T16:34:36Z",
  "authorization": {
    "delegation_id": "DELEG-20260807-HUMAN-FAST-TRIAGE-V1",
    "authorized_loop": "daily-research-operator",
    "acceptance_slice": "Compare exactly two declared synthetic QST-SIM-0003 role mixes under one identical deterministic GEO-ring fixture using the accepted receiver-visibility primitive: an all-independent baseline and one coordinated mix with a fixed declared storage-node fraction. Record energy, survival, curtailment, coverage, and host-delivery accounting already available from the accepted model, add focused tests, and emit at most one deterministic comparison artifact. Preserve the result whether positive, neutral, or negative. This slice measures one bounded comparison only and does not select an architecture or tune parameters to force a winner.",
    "source_commit": "9c72a0d6dd5e35785498781b70bd176a57e5e89f",
    "expires_at": "2026-09-01T13:00:00Z",
    "allowed_write_surfaces": [
      "src/**",
      "experiments/**",
      "configs/**",
      "tests/**",
      "outputs/**"
    ],
    "budgets": {
      "external_evidence_items": 0,
      "synthetic_parameter_sets": 1,
      "role_mixes": 2,
      "implementation_files_max": 5,
      "output_artifacts_max": 1
    },
    "max_pull_requests": 1,
    "max_run_receipts": 1,
    "mandatory_checks": [
      "python -m pytest -q tests/test_automation_*.py",
      "python -m automation.cli validate-repository"
    ],
    "stop_conditions": [
      "Accepted main, delegation, research graph readiness, or live implementation ownership changes incompatibly before publication.",
      "The comparison requires a real GEO ephemeris, external observational evidence, antenna or Earth-occlusion fidelity, new beam-efficiency physics, or another protected scientific assumption.",
      "The slice requires choosing among multiple coordinated architectures, optimizing the storage fraction, sweeping beam efficiency or eclipse fraction, or making a mission-value or hardware-readiness claim.",
      "Any quest, queue, belief, canonical-memory, contract, schema, delegation, runtime-manifest, public-document, or Weekly-owned evidence mutation is required.",
      "A mandatory repository evaluator fails or a substantive review finding requires scope expansion."
    ],
    "next_action": "Daily Research Operator: from accepted source 9c72a0d6dd5e35785498781b70bd176a57e5e89f, consume this AUTH and implement exactly one deterministic two-role-mix comparison for QST-SIM-0003 using one identical synthetic fixture and the accepted receiver-visibility primitive; add focused tests and at most one output artifact, open exactly one implementation PR, write exactly one implementation receipt, run the mandatory evaluator, and stop before architecture selection, parameter optimization, beam-efficiency/eclipsing sweeps, or external evidence."
  }
}
