{
  "schema": "sns.governance-authorization.v1",
  "authorization_id": "AUTH-20260808T161025000000Z-calendar-duplicate-id-4a8f91c2d7e603b5a124",
  "issued_by_loop": "daily-governance-triage",
  "action_type": "refine_existing",
  "quest_id": "QST-CALENDAR-0001",
  "recorded_at": "2026-08-08T16:10:25Z",
  "authorization": {
    "delegation_id": "DELEG-20260807-HUMAN-FAST-TRIAGE-V1",
    "authorized_loop": "daily-research-operator",
    "acceptance_slice": "Add deterministic duplicate quest-ID validation to the existing roundup parsing/normalization path with focused tests. Do not implement the staging CLI, append belief shifts, process a real roundup, activate quests, or mutate queue/canonical state.",
    "source_commit": "b947bf0af93dda0a0d2725ed89e30b9996372819",
    "expires_at": "2026-08-09T06:00:00Z",
    "allowed_write_surfaces": [
      "src/**",
      "tests/**",
      "outputs/**"
    ],
    "budgets": {
      "max_files_changed": 5,
      "max_new_test_files": 1,
      "max_implementation_prs": 1,
      "scientific_claim_changes": 0
    },
    "max_pull_requests": 1,
    "max_run_receipts": 1,
    "mandatory_checks": [
      "python -m pytest -q tests/test_automation_*.py",
      "python -m automation.cli validate-repository"
    ],
    "stop_conditions": [
      "Any required write falls outside src/**, tests/**, or outputs/**.",
      "Implementation requires staging CLI work under scripts/**.",
      "Implementation would append belief shifts, process real weekly evidence, activate or reprioritize a quest, or mutate canonical memory.",
      "Duplicate-ID semantics require a scientific or governance choice not already fixed by the active quest success criterion.",
      "A competing implementation owner or PR appears for this acceptance slice.",
      "Mandatory validation fails and cannot be repaired within this bounded slice."
    ],
    "next_action": "Inspect the existing roundup parser and quest normalization path, implement only deterministic duplicate quest-ID rejection inside authorized src/** surfaces, add focused tests, open at most one implementation PR, and run the mandatory repository checks."
  }
}
