{
  "schema": "sns.governance-authorization.v1",
  "authorization_id": "AUTH-20260815T165114000000Z-stor-fast-rotator-constraint-cost-7b3e91c4d8a6052f1c20",
  "issued_by_loop": "daily-governance-triage",
  "action_type": "refine_existing",
  "quest_id": "QST-STOR-0002",
  "recorded_at": "2026-08-15T16:51:14Z",
  "authorization": {
    "delegation_id": "DELEG-20260807-HUMAN-FAST-TRIAGE-V1",
    "authorized_loop": "daily-research-operator",
    "acceptance_slice": "Quantify the hidden cost of the already-declared <=30-minute fast-rotator surface constraint and illuminated-state heat rejection using bounded synthetic/screening assumptions, uncertainty, and a falsifier, without selecting between surface and hosted architectures or repeating the matched mission-dependency ledger completed by PRs #35-#37.",
    "source_commit": "e0fe4166b72a3f6bbcdaebf9b7a1b6c4686464b6",
    "expires_at": "2026-08-16T16:51:14Z",
    "allowed_write_surfaces": [
      "experiments/**",
      "configs/**",
      "tests/**",
      "outputs/**"
    ],
    "budgets": {
      "implementation_pull_requests": 1,
      "implementation_receipts": 1,
      "new_or_modified_experiment_files": 1,
      "new_or_modified_config_files": 1,
      "new_or_modified_test_files": 1,
      "new_or_modified_output_files": 1,
      "external_data_sources": 0,
      "architecture_selections": 0,
      "quest_state_changes": 0,
      "belief_changes": 0
    },
    "max_pull_requests": 1,
    "max_run_receipts": 1,
    "mandatory_checks": [
      "python -m pytest -q tests/test_automation_*.py",
      "python -m automation.cli validate-repository"
    ],
    "stop_conditions": [
      "Stop if the slice requires choosing or recommending surface deployment versus active sunward hosted operation.",
      "Stop if target-availability claims require external observational evidence rather than explicitly declared synthetic/screening assumptions.",
      "Stop if illuminated-state heat rejection requires a new protected material property, package geometry, or thermal architecture assumption not already represented in accepted QST-STOR-0002 artifacts.",
      "Stop before changing quests, queue priority, consolidated beliefs, canonical memory, contracts, schemas, delegation law, workflows, or public/external claims.",
      "Stop rather than repeat, reopen, or recreate the matched mission-dependency ledger or allocation reproduction already completed by PRs #35-#37.",
      "Stop on failed mandatory validation, ownership conflict, or acceptance-slice expansion beyond the declared file and transaction budgets."
    ],
    "next_action": "Reuse accepted QST-STOR-0002 screening assumptions to produce one reproducible fast-rotator constraint-cost artifact with explicit target-availability assumptions, illuminated-state thermal constraint accounting, uncertainty, and a falsifier; add one focused regression test, open exactly one implementation PR, run the mandatory evaluator, and stop before architecture selection or belief/governance changes."
  }
}
