{
  "schema": "sns.governance-authorization.v1",
  "authorization_id": "AUTH-20260902T190916629850Z-arci-september-refine-b1c2d3e4f5a60718293a",
  "issued_by_loop": "daily-governance-triage",
  "action_type": "refine_existing",
  "quest_id": "QST-ARCI-0001",
  "recorded_at": "2026-09-02T19:09:16.629850Z",
  "authorization": {
    "delegation_id": "DELEG-20260902-HUMAN-SEPTEMBER-TRIAGE-V1",
    "authorized_loop": "daily-research-operator",
    "acceptance_slice": "Produce one reproducible QST-ARCI-0001 synthetic-target assessment using the accepted ARCI v0.1 model: attach explicit evidence types and missing-data flags, keep score and confidence separate, run bounded weight and confidence sensitivity, and identify the next measurement without unsupported dollar valuation or queue, belief, or architecture changes.",
    "source_commit": "6785ffcb158841ad1a7f4614cf0a3af3de1af5b1",
    "expires_at": "2026-09-03T19:09:16.629850Z",
    "allowed_write_surfaces": [
      "configs/**",
      "experiments/**",
      "tests/**",
      "outputs/**"
    ],
    "budgets": {
      "implementation_pull_requests": 1,
      "implementation_receipts": 1,
      "new_or_modified_config_files": 1,
      "new_or_modified_experiment_files": 1,
      "new_or_modified_test_files": 1,
      "new_or_modified_output_files": 1,
      "synthetic_targets": 1,
      "external_data_sources": 0,
      "unsupported_dollar_valuations": 0,
      "quest_state_changes": 0,
      "belief_changes": 0
    },
    "max_pull_requests": 1,
    "max_run_receipts": 1,
    "mandatory_checks": [
      "python -m pytest -q tests/test_automation_*.py",
      "python -m automation.cli validate-repository"
    ],
    "stop_conditions": [
      "Stop if the slice requires external observational evidence or representing the synthetic target as a real asteroid assessment.",
      "Stop if small bounded weight perturbations cause major grade reversals; preserve the result as falsifying or limiting evidence rather than tuning weights to recover a headline grade.",
      "Stop if implementation requires changing the ARCI scoring architecture, dimension ontology, or another major scientific route rather than exercising the accepted v0.1 model.",
      "Stop before changing quests, queue membership or priority, consolidated beliefs, canonical memory, contracts, schemas, delegation law, workflows, or public/external claims.",
      "Stop on failed mandatory validation, ownership conflict, source drift that invalidates this acceptance slice, or expansion beyond the declared file and transaction budgets."
    ],
    "next_action": "Create one short-lived implementation owner for QST-ARCI-0001, encode one clearly synthetic target with evidence types and missing-data flags, run the accepted ARCI v0.1 score/confidence and bounded sensitivity analysis, emit one reproducible JSON assessment with a next-measurement recommendation, add focused tests, open exactly one implementation PR, and run the mandatory evaluator."
  }
}
