{
  "schema": "sns.governance-authorization.v1",
  "authorization_id": "AUTH-20260829T161812000000Z-sim3-receiver-los-7d3a91c4b8e2056f1a2c",
  "issued_by_loop": "daily-governance-triage",
  "action_type": "refine_existing",
  "quest_id": "QST-SIM-0003",
  "recorded_at": "2026-08-29T16:18:12Z",
  "authorization": {
    "delegation_id": "DELEG-20260807-HUMAN-FAST-TRIAGE-V1",
    "authorized_loop": "daily-research-operator",
    "acceptance_slice": "Add one bounded deterministic receiver/line-of-sight window primitive to the existing GEORingWorld baseline, preserve legacy always-visible behavior by default, expose the resulting boolean through EnvironmentSample.line_of_sight_to_host, add focused synthetic tests, and emit at most one small deterministic phase-sweep output. This slice measures visibility only; it does not compare role mixes, storage fractions, relay efficiency, or architecture value.",
    "source_commit": "9fb924182ec1a772383229f3219b5aa55ec1d9c0",
    "expires_at": "2026-08-30T16:18:12Z",
    "allowed_write_surfaces": [
      "src/**",
      "tests/**",
      "outputs/**"
    ],
    "budgets": {
      "external_evidence_items": 0,
      "synthetic_parameter_sets": 1,
      "implementation_files_max": 4,
      "output_artifacts_max": 1
    },
    "max_pull_requests": 1,
    "max_run_receipts": 1,
    "mandatory_checks": [
      "python -m pytest -q tests/test_automation_*.py",
      "python -m automation.cli validate-repository"
    ],
    "stop_conditions": [
      "Any source drift or competing live implementation owner for QST-SIM-0003 appears before publication.",
      "The implementation requires a real GEO receiver ephemeris, external observational evidence, antenna pattern, Earth-occlusion fidelity claim, or other protected physical assumption beyond an explicit synthetic phase window.",
      "The slice expands into role-mix, storage-node-fraction, beam-efficiency, power-relay, architecture-selection, or mission-value comparison.",
      "Any quest, queue, belief, canonical-memory, contract, schema, delegation, runtime-manifest, or public-document mutation is required.",
      "A mandatory repository evaluator fails or a substantive review finding requires scope expansion."
    ],
    "next_action": "Daily Research Operator: from accepted source 9fb924182ec1a772383229f3219b5aa55ec1d9c0, implement the smallest configurable synthetic receiver visibility window in GEORingWorld, add focused tests and at most one deterministic phase-sweep output, open exactly one implementation PR, write exactly one implementation receipt consuming this AUTH ID, run the mandatory evaluator, and stop before any relay-performance or architecture comparison."
  }
}
