{
  "schema": "sns.governance-authorization.v1",
  "authorization_id": "AUTH-20260827T163736000000Z-meta-beam-loss-4a7c91e2b805d63f102a",
  "issued_by_loop": "daily-governance-triage",
  "action_type": "refine_existing",
  "quest_id": "QST-META-0001",
  "recorded_at": "2026-08-27T16:37:36Z",
  "authorization": {
    "delegation_id": "DELEG-20260807-HUMAN-FAST-TRIAGE-V1",
    "authorized_loop": "daily-research-operator",
    "acceptance_slice": "Implement one bounded pure-Python QST-META-0001 beam-link loss abstraction over steering angle and pointing error using explicit synthetic parameters, emit one deterministic sweep artifact, and add focused tests while preserving the boundary between a data-link abstraction and any physical power-beam claim.",
    "source_commit": "b5bd0790db06c49aa376ecd51f4691eeb4d65844",
    "expires_at": "2026-08-28T16:37:36Z",
    "allowed_write_surfaces": [
      "src/**",
      "tests/**",
      "outputs/**"
    ],
    "budgets": {
      "implementation_pull_requests": 1,
      "implementation_receipts": 1,
      "new_or_modified_source_files": 1,
      "new_or_modified_test_files": 1,
      "new_or_modified_output_files": 1,
      "synthetic_parameter_sets": 1,
      "external_data_sources": 0,
      "quest_state_changes": 0,
      "belief_changes": 0
    },
    "max_pull_requests": 1,
    "max_run_receipts": 1,
    "mandatory_checks": [
      "python -m pytest -q tests/test_automation_*.py",
      "python -m automation.cli validate-repository"
    ],
    "stop_conditions": [
      "Stop if the slice requires external empirical evidence, hardware-readiness claims, or representing the synthetic sweep as validated SNS-scale power transfer.",
      "Stop if implementation requires choosing a new metasurface architecture, protected physical assumption, receiver technology, or strategic route rather than exercising the quest's declared compact abstraction.",
      "Stop if the bounded sweep shows relay losses erase the modeled benefit; preserve that as falsifying or limiting evidence rather than tuning parameters to recover a favorable result.",
      "Stop before changing quests, queue membership or priority, consolidated beliefs, canonical memory, contracts, schemas, delegation law, workflows, documentation claims, or public/external actions.",
      "Stop on failed mandatory validation, ownership conflict, source drift that invalidates this acceptance slice, or expansion beyond the declared file and transaction budgets."
    ],
    "next_action": "Create one short-lived QST-META-0001 implementation owner from the authorized source commit, implement the smallest inspectable steering-angle/pointing-error loss function with one declared synthetic parameter set, emit one deterministic sweep JSON, add focused tests, open exactly one implementation PR, write exactly one Daily receipt consuming this AUTH ID, run the mandatory evaluator, and stop before architecture expansion or physical power-beam claims."
  }
}
