{
  "schema": "sns.governance-authorization.v1",
  "authorization_id": "AUTH-20260811T160132000000Z-calendar-staging-output-6e2f4a91c8b7053d1f20",
  "issued_by_loop": "daily-governance-triage",
  "action_type": "refine_existing",
  "quest_id": "QST-CALENDAR-0001",
  "recorded_at": "2026-08-11T16:01:32Z",
  "authorization": {
    "delegation_id": "DELEG-20260807-HUMAN-FAST-TRIAGE-V1",
    "authorized_loop": "daily-research-operator",
    "acceptance_slice": "Extend the accepted proposal-only roundup staging boundary with deterministic serialization/output generation for synthetic staged roundups under outputs/**, using the existing src/research/roundup_staging.py interface and focused tests. This slice must not add or edit scripts/**, process real weekly evidence, append belief shifts, activate or reprioritize quests, mutate queue/canonical memory, or choose scientific content.",
    "source_commit": "e8d3c423f77349bd9f0c6dac0195fa24d7049834",
    "expires_at": "2026-08-12T06:00:00Z",
    "allowed_write_surfaces": ["src/**", "tests/**", "outputs/**"],
    "budgets": {
      "max_files_changed": 6,
      "max_new_test_files": 1,
      "max_implementation_prs": 1,
      "max_run_receipts": 1,
      "scientific_claim_changes": 0,
      "real_roundups_processed": 0,
      "belief_or_queue_mutations": 0
    },
    "max_pull_requests": 1,
    "max_run_receipts": 1,
    "mandatory_checks": [
      "python -m pytest -q tests/test_automation_*.py",
      "python -m automation.cli validate-repository"
    ],
    "stop_conditions": [
      "Any required implementation write falls outside src/**, tests/**, or outputs/**.",
      "Implementation requires scripts/** or editing automation contracts, schemas, delegation law, state ownership, calendar consolidated beliefs, quests queue state, memory, or GitHub workflow policy.",
      "Implementation would process a real weekly roundup or interpret evidence rather than serialize deterministic synthetic staged structure.",
      "Implementation would append belief shifts, activate, retire, block, reprioritize, or otherwise mutate a quest.",
      "Output semantics require a scientific or governance choice not already fixed by the accepted QST-CALENDAR-0001 proposal-only staging boundary.",
      "A competing implementation owner or pull request appears for this acceptance slice.",
      "Mandatory validation fails and cannot be repaired within this bounded slice."
    ],
    "next_action": "Extend the accepted roundup staging module with the smallest deterministic serializer/output writer for synthetic staged records, add focused tests proving stable output and no governance side effects, optionally emit only synthetic fixture output under outputs/**, open at most one implementation PR, and run the mandatory repository checks."
  }
}